{
  "$schema": "../../schemas/case.schema.json",
  "schema_version": 1,
  "id": "secure_workspace",
  "title": {
    "it": "Hardening filesystem, scritture atomiche e redazione segreti",
    "en": "Filesystem hardening, atomic writes, and secret redaction"
  },
  "category": "security",
  "weight": 1.25,
  "paths": {
    "prompt": "prompt.md",
    "fixture": "fixture",
    "grader": "grader.py"
  }
}
