{
  "$schema": "../../schemas/case.schema.json",
  "schema_version": 1,
  "id": "thinking_challenge",
  "title": {
    "it": "Pianificazione deterministica multi-vincolo",
    "en": "Deterministic multi-constraint planning"
  },
  "category": "reasoning",
  "weight": 1.25,
  "paths": {
    "prompt": "prompt.md",
    "fixture": "fixture",
    "grader": "grader.py"
  }
}
